course_name,keywords
(MP1) Sustainable  energy technologies and strategies in urban environment ,Renewable energy Solar power Wind energy Hydroelectric power Biomass energy Geothermal energy Energy efficiency Smart grids Energy storage Clean energy
(MP2) Decarbonization strategies and social innovation for cities and communities,Carbon reduction Climate change mitigation Greenhouse gas emissions Low-carbon technologies Circular economy Community engagement Social entrepreneurship Sustainable transportation Ecofriendly practices Carbon offsetting
(MP3) Advanced design of sustainable cities,Urban planning Green infrastructure Sustainable architecture Urban development Smart cities Eco-friendly buildings Urban regeneration Low impact design Urban mobility Resilient cities
(MP4) Business and finance strategies  for a sustainable urban transition,finance business Sustainable business models Green finance Corporate sustainability Impact investing Environmental economics Public private partnerships Sustainable supply chains Social responsibility Sustainable investments Circular economy business
(MP5) Sustainability by design: developing a resilient built environment,Sustainable construction Green building materials Resilience planning Climate adaptation Disaster preparedness Sustainable infrastructure Energy-efficient buildings Water managementSustainable landscaping Sustainable urbanization
(MP6) Innovation in the urban energy sector: strategies and management,Energy innovation Energy technology advancements Energy startups Energy policy Energy market trends Energy project management Energy system optimization Energy regulations Energy distribution Energy monitoring and control
(MP7) Sustainable energy solutions for cities: policy and implementation strategies,Energy policy development Renewable energy targets Clean energy incentives Energy regulations Energy subsidies Energy governance Energy transition planning Public-private cooperation Energy conservation programs Renewable energy integration
(MP8) Sustainable finance and energy transition in cities,Green bonds Climate finance Energy investment Sustainable banking ESG Environmental Social Governance criteria Carbon pricing Clean energy financing Fossil fuel divestmentSustainable economic development Sustainable finance frameworks
